{
  "$schema": "https://json-schema.org/draft/2020-12/schema",
  "$id": "https://lagovista.com/schemas/auth-model/app-user-test-scenario-v2.schema.json",
  "title": "UI-Bound App User Test Scenario",
  "type": "object",
  "additionalProperties": false,
  "required": [
    "$schema",
    "schemaVersion",
    "key",
    "name",
    "summary",
    "version",
    "maturity",
    "progress",
    "categoryKey",
    "startViewKey",
    "action",
    "preconditions",
    "inputs",
    "serverInteraction",
    "expectedViewKey",
    "postconditions",
    "expectedAuthLogEvents",
    "evidenceRequirements",
    "sourceReferences"
  ],
  "properties": {
    "$schema": {
      "type": "string"
    },
    "schemaVersion": {
      "const": "2.0"
    },
    "key": {
      "type": "string",
      "pattern": "^auth\\.scenario\\.[a-z][a-z0-9-]{1,63}(\\.[a-z][a-z0-9-]{1,63})*$"
    },
    "name": {
      "type": "string",
      "minLength": 1
    },
    "summary": {
      "type": "string",
      "minLength": 1
    },
    "version": {
      "type": "integer",
      "minimum": 1
    },
    "maturity": {
      "enum": [
        "proposed",
        "reviewed",
        "approved",
        "implemented",
        "verified",
        "deprecated"
      ]
    },
    "categoryKey": {
      "type": "string",
      "pattern": "^[a-z][a-z0-9-]{1,63}$"
    },
    "startViewKey": {
      "$ref": "#/$defs/viewKey"
    },
    "action": {
      "type": "object",
      "additionalProperties": false,
      "required": [
        "id",
        "finder"
      ],
      "properties": {
        "id": {
          "type": "string",
          "pattern": "^[a-z][a-z0-9]*(?:-[a-z0-9]+)*$"
        },
        "finder": {
          "type": "string",
          "pattern": "^action:[a-z][a-z0-9]*(?:-[a-z0-9]+)*$"
        }
      }
    },
    "preconditions": {
      "$ref": "#/$defs/stateAssertion"
    },
    "inputs": {
      "type": "array",
      "items": {
        "$ref": "#/$defs/input"
      }
    },
    "serverInteraction": {
      "type": "object",
      "additionalProperties": false,
      "required": [
        "required"
      ],
      "properties": {
        "required": {
          "type": "boolean"
        },
        "intent": {
          "type": "string",
          "minLength": 1
        },
        "transitionKeys": {
          "type": "array",
          "uniqueItems": true,
          "items": {
            "type": "string",
            "pattern": "^auth\\.transition\\."
          }
        }
      }
    },
    "expectedViewKey": {
      "$ref": "#/$defs/viewKey"
    },
    "expectedVisibleFinders": {
      "type": "array",
      "uniqueItems": true,
      "items": {
        "type": "string",
        "minLength": 1
      }
    },
    "postconditions": {
      "$ref": "#/$defs/stateAssertion"
    },
    "expectedAuthLogEvents": {
      "type": "array",
      "items": {
        "type": "string",
        "minLength": 1
      }
    },
    "evidenceRequirements": {
      "type": "array",
      "uniqueItems": true,
      "items": {
        "enum": [
          "server",
          "web",
          "android",
          "ios",
          "vtm"
        ]
      }
    },
    "sourceReferences": {
      "type": "array",
      "items": {
        "$ref": "#/$defs/sourceReference"
      }
    },
    "definitionHash": {
      "type": "string",
      "pattern": "^[a-f0-9]{64}$"
    },
    "progress": {
      "$ref": "auth-reconciliation-progress.schema.json#/$defs/scenarioProgress",
      "description": "Tracks reviewed presentation, implementation, and test reconciliation phases for this atomic scenario."
    }
  },
  "$defs": {
    "viewKey": {
      "type": "string",
      "pattern": "^(auth|app)\\.[a-z][a-z0-9-]{1,63}(\\.[a-z][a-z0-9-]{1,63})*$"
    },
    "stateAssertion": {
      "type": "object",
      "additionalProperties": false,
      "required": [
        "expression"
      ],
      "properties": {
        "expression": {
          "type": "string",
          "minLength": 1
        },
        "description": {
          "type": "string"
        },
        "state": {
          "$ref": "#/$defs/authTenantStateSnapshot",
          "description": "Machine-readable execution projection of the state required or expected by this scenario."
        }
      }
    },
    "setCondition": {
      "enum": [
        "set",
        "notset",
        "dontcare"
      ]
    },
    "oneTimeCodeStatus": {
      "enum": [
        "dontcare",
        "notset",
        "valid",
        "expired",
        "consumed"
      ]
    },
    "oneTimeCodeState": {
      "type": "object",
      "additionalProperties": false,
      "required": [
        "status"
      ],
      "properties": {
        "status": {
          "$ref": "#/$defs/oneTimeCodeStatus"
        },
        "attemptCount": {
          "type": "integer",
          "minimum": 0
        }
      }
    },
    "authTenantStateSnapshot": {
      "type": "object",
      "additionalProperties": false,
      "properties": {
        "belongsToOrg": {
          "$ref": "#/$defs/setCondition"
        },
        "emailConfirmed": {
          "$ref": "#/$defs/setCondition"
        },
        "ensurePendingIdentity": {
          "$ref": "#/$defs/setCondition"
        },
        "userHasOAuthGitHub": {
          "$ref": "#/$defs/setCondition"
        },
        "userHasEmail": {
          "$ref": "#/$defs/setCondition"
        },
        "userHasFirstName": {
          "$ref": "#/$defs/setCondition"
        },
        "userHasLastName": {
          "$ref": "#/$defs/setCondition"
        },
        "phoneNumberConfirmed": {
          "$ref": "#/$defs/setCondition"
        },
        "twoFactorEnabled": {
          "$ref": "#/$defs/setCondition"
        },
        "isAccountDisabled": {
          "$ref": "#/$defs/setCondition"
        },
        "isUserLoggedIn": {
          "$ref": "#/$defs/setCondition"
        },
        "isOrgAdmin": {
          "$ref": "#/$defs/setCondition"
        },
        "hasPassword": {
          "$ref": "#/$defs/setCondition"
        },
        "hasPasskey": {
          "$ref": "#/$defs/setCondition"
        },
        "generateConfirmEmail": {
          "$ref": "#/$defs/setCondition"
        },
        "sendMagicLink": {
          "$ref": "#/$defs/setCondition"
        },
        "hasTOTP": {
          "$ref": "#/$defs/setCondition"
        },
        "isAnonymous": {
          "$ref": "#/$defs/setCondition"
        },
        "showWelcome": {
          "$ref": "#/$defs/setCondition"
        },
        "externalLoginProviders": {
          "type": "array",
          "uniqueItems": true,
          "items": {
            "type": "string",
            "minLength": 1
          }
        },
        "lastMfaDateTimeUtc": {
          "type": "string"
        },
        "ensureUserExists": {
          "$ref": "#/$defs/setCondition"
        },
        "ensureUserDoesNotExist": {
          "$ref": "#/$defs/setCondition"
        },
        "passwordRecoveryCode": {
          "$ref": "#/$defs/oneTimeCodeState"
        },
        "emailVerificationCode": {
          "$ref": "#/$defs/oneTimeCodeState"
        }
      }
    },
    "input": {
      "type": "object",
      "additionalProperties": false,
      "required": [
        "finder",
        "name",
        "valueType",
        "required"
      ],
      "properties": {
        "finder": {
          "type": "string",
          "pattern": "^(field|control):[a-z][a-z0-9]*(?:-[a-z0-9]+)*$"
        },
        "name": {
          "type": "string",
          "minLength": 1
        },
        "valueType": {
          "enum": [
            "string",
            "boolean",
            "integer",
            "timestamp",
            "reference",
            "secret-reference"
          ]
        },
        "required": {
          "type": "boolean"
        },
        "example": {},
        "description": {
          "type": "string"
        }
      }
    },
    "sourceReference": {
      "type": "object",
      "additionalProperties": false,
      "required": [
        "sourceType",
        "reference"
      ],
      "properties": {
        "sourceType": {
          "enum": [
            "ddr",
            "code",
            "test",
            "discussion",
            "decision",
            "auth-view",
            "behavior",
            "external"
          ]
        },
        "reference": {
          "type": "string",
          "minLength": 1
        },
        "section": {
          "type": "string"
        },
        "commit": {
          "type": "string"
        },
        "note": {
          "type": "string"
        }
      }
    }
  }
}
