{
  "$schema": "../../schemas/app-user-test-scenario-v2.schema.json",
  "schemaVersion": "2.0",
  "key": "auth.scenario.password-sign-in.welcome-to-email-entry",
  "name": "Welcome to Email Entry",
  "summary": "The user chooses email authentication from the Welcome view and the client opens the email-entry view.",
  "version": 1,
  "maturity": "proposed",
  "categoryKey": "password-sign-in",
  "startViewKey": "auth.welcome",
  "action": {
    "id": "continue-email",
    "finder": "action:continue-email"
  },
  "preconditions": {
    "expression": "session-capability == anonymous and auth.welcome is visible"
  },
  "inputs": [],
  "serverInteraction": {
    "required": false
  },
  "expectedViewKey": "auth.continue.email",
  "postconditions": {
    "expression": "session-capability == anonymous and auth.continue.email is visible"
  },
  "expectedAuthLogEvents": [],
  "evidenceRequirements": [
    "web",
    "android",
    "ios"
  ],
  "sourceReferences": [
    {
      "sourceType": "auth-view",
      "reference": "auth.welcome"
    },
    {
      "sourceType": "auth-view",
      "reference": "auth.continue.email"
    },
    {
      "sourceType": "decision",
      "reference": "ChatGPT conversation 2026-08-09",
      "note": "Presentation review confirms the existing Welcome and Continue with Email surfaces as the shared client-only prefix for password sign-in."
    }
  ],
  "progress": {
    "presentation": "complete",
    "implementation": "not-started",
    "tests": "not-started"
  }
}
